{
  "attribute": "passenger capacity",
  "conditions": [
    "unconventional threats",
    "conventional armored battle",
    "northeast Asia intense battle"
  ],
  "confidence": "explicit",
  "createdAt": "2013-04-30T00:00:00Z",
  "createdBy": {
    "actorId": "shreyash",
    "actorType": "human"
  },
  "criteria": {
    "$exclusion": "ex-no-thresholds"
  },
  "id": "m-pax",
  "ingestionProvenance": {
    "extractedAt": "2026-09-05",
    "extractor": "human",
    "locator": "p. 34",
    "sourceArtifact": "sources/cbo-2013-04-gcv-program-and-alternatives.pdf"
  },
  "measure": "percentage increase in passengers carried beyond the current Bradley's seven",
  "metric": {
    "direction": "max",
    "units": "percent vs the current Bradley IFV"
  },
  "objective": "obj-capability",
  "rev": 1,
  "task": "Carry the squad",
  "type": "Measure",
  "valueFunction": {
    "kind": "identity"
  }
}
